<?xml version="1.0"?>
<!-- <!DOCTYPE exercise SYSTEM "exercise.dtd"> -->
<!-- 
 For developers 
 This is a BASIC  example/template of an exercise file 
-->
<exercise id="0" version="$Rev: 202 $" start="20070512 000000" end="20070524 185800" mchoice="4">
    <description><![CDATA[1η σειρά ασκήσεων (2ο & 3ο κεφάλαιο)]]></description>
    <!-- Chapter 2 -->
    <question>
        <text>Τα βασικά στοιχεία ενός Δικτύου είναι τα:</text>
        <answer correct="true">Πρωτόκολλο, Σταθμός, Μέσο μετάδοσης, Μήνυμα</answer>
        <answer>Πρωτόκολλο, αξιοπιστία, Τοπικό Δίκτυο, Μητροπολιτικό Δίκτυο</answer>
        <answer>Μήνυμα, Τοπικό Δίκτυο, Ταχύτητα μετάδοσης, Αξιοπιστία Μετάδοσης</answer>
        <answer>Πρωτόκολλο, Σταθμός, Μέσο μετάδοσης, Μήνυμα, Ταχύτητα Μετάδοσης, Αξιοπιστία, Ακρίβεια Παράδοσης</answer>
    </question>
    <question>
        <text>Η απόδοση ενός δικτύου δεδομένων εξαρτάται από:</text>
        <answer correct="true">Ταχύτητα παράδοσης, αξιοπιστία, ακρίβεια παράδοσης</answer>
        <answer>Πρωτόκολλα που χρησιμοποιούνται, σύγχρονη τεχνολογία, γρήγοροι εξυπηρετητές</answer>
        <answer>Τοπολογία δικτύου, τεχνολογία που χρησιμοποιείται</answer>
    </question>
    <question>
        <text>Ένα Μητροπολιτικό δίκτυο αποτελείται από πολλά δίκτυα ευρείας ζώνης</text>
        <answer>Σωστό</answer>
        <answer correct="true">Λάθος</answer>
    </question>
    <question>
        <text>Σε μία πόλη, πόσα ανεξάρτητα Μητροπολιτικά δίκτυα μπορούν να υπάρχουν;</text>
        <answer correct="true">Δεν υπάρχει περιορισμός</answer>
        <answer>Μόνο ένα</answer>
        <answer>Εξαρτάται από το πόσα LANs συνδέονται σε αυτά</answer>
    </question>
</exercise>